{
  "skill": "superpowers-brainstorm",
  "model": "Claude Sonnet 4.6 (Thinking)",
  "date": "2026-05-25",
  "goal": "Perform a comprehensive Enterprise Architectural Audit on Deno Edge functions, webhook replay guard, and rate limiting to enforce strict type safety and secure webhook endpoints.",
  "constraints": [
    "Strict type safety - zero 'any' or 'as any' casts are allowed.",
    "Enforce mandatory 'x-timestamp' replay guard on webhooks.",
    "Validate rate limit options to prevent division by zero or negative bounds."
  ],
  "known_context": "Venthub HVAC portal requires high enterprise-grade security for webhooks and API rate limiting.",
  "risks": [
    {
      "severity": "high",
      "description": "Rate limiting options are bypassed due to option field naming mismatches."
    },
    {
      "severity": "critical",
      "description": "Webhook endpoints are vulnerable to replay attacks because of optional timestamp verification."
    }
  ],
  "options": [
    {
      "id": "A",
      "title": "Strict Deno Edge Function Refactoring",
      "selected": true,
      "reason": "Enforces full type safety, adds strict timestamp verification on webhook endpoints, and robust bounds checks on rate limiter inputs."
    },
    {
      "id": "B",
      "title": "Optional Replay Guard with Slack Validation",
      "selected": false,
      "reason": "Fails to meet VentHub Enterprise standards and allows potential security bypasses."
    }
  ],
  "recommendation": "Option A is highly recommended to align with VentHub HVAC architecture standards and eliminate security vulnerabilities.",
  "traces": [
    {
      "tool": "view_file",
      "target": "supabase/functions/returns-webhook/index.ts",
      "finding": "Found that returns webhook had an optional timestamp check."
    },
    {
      "tool": "grep_search",
      "target": "supabase/functions/_shared/rate_limit.ts",
      "finding": "Identified default rate limits lack defensive finite constraints."
    }
  ]
}